{
  "carbonFootprintperLifecycleStage": [
    {
      "lifeCycleStage": "RawMaterialExtraction",
      "carbonFootprintPerLifecycleStage": 0
    }
  ],
  "carbonFoortPrintStudy": "telnet://192.0.2.16:80/",
  "batteryCarbonFootprint": 0,
  "carbonFootPrintPerformanceClass": "eOMtThyhVNLWUZNRcBaQKxI"
}